[
  {
    "contract": "woml.artifact-operation-settlement",
    "contractVersion": 1,
    "operationKey": "sha256:bbbbbbbbbbbbbbbbbbbbbbbbbbbbbbbbbbbbbbbbbbbbbbbbbbbbbbbbbbbbbbbb",
    "runId": "run-artifact-a",
    "nodeId": "createPlan",
    "attemptNumber": 1,
    "operation": "put",
    "inputDigest": "sha256:cccccccccccccccccccccccccccccccccccccccccccccccccccccccccccccccc",
    "status": "started",
    "startedAt": "2026-10-11T10:00:00.000Z"
  },
  {
    "contract": "woml.artifact-operation-settlement",
    "contractVersion": 1,
    "operationKey": "sha256:bbbbbbbbbbbbbbbbbbbbbbbbbbbbbbbbbbbbbbbbbbbbbbbbbbbbbbbbbbbbbbbb",
    "runId": "run-artifact-a",
    "nodeId": "createPlan",
    "attemptNumber": 1,
    "operation": "put",
    "inputDigest": "sha256:cccccccccccccccccccccccccccccccccccccccccccccccccccccccccccccccc",
    "status": "succeeded",
    "artifactId": "artifact_01k7qh7s00a1b2c3d4e5f6g7h8",
    "contentDigest": "sha256:c742b8669e07a0ca8a2a8d79b22b17504c51f7b0d81623a8045fece436f02942",
    "size": 184320,
    "resultDigest": "sha256:dddddddddddddddddddddddddddddddddddddddddddddddddddddddddddddddd",
    "startedAt": "2026-10-11T10:00:00.000Z",
    "settledAt": "2026-10-11T10:00:00.049Z"
  },
  {
    "contract": "woml.artifact-operation-settlement",
    "contractVersion": 1,
    "operationKey": "sha256:eeeeeeeeeeeeeeeeeeeeeeeeeeeeeeeeeeeeeeeeeeeeeeeeeeeeeeeeeeeeeeee",
    "runId": "run-artifact-b",
    "nodeId": "createBackup",
    "attemptNumber": 1,
    "operation": "put",
    "inputDigest": "sha256:ffffffffffffffffffffffffffffffffffffffffffffffffffffffffffffffff",
    "status": "interrupted",
    "errorCode": "WOML_ARTIFACT_INTERRUPTED",
    "ambiguous": true,
    "startedAt": "2026-10-11T10:01:00.000Z",
    "settledAt": "2026-10-11T10:01:02.000Z"
  }
]
